{"attribution":"Japan Meteorological Agency (JMA)","image_digest":"sha256:ecac0623b53cb4b2dc87a545a896aff055258081a01c2e076d0c1d5477c688d2","media_type":"image/jpeg","observation_time":"2026-09-15T08:50:00Z","platform":"Himawari-8/9","product":"Full Disk Band 13 infrared","provider":"Japan Meteorological Agency (JMA)","retrieved_at":"2026-09-15T09:14:30Z","schema":"urn:skyseal:sky-witness:v1","source_url":"https://www.data.jma.go.jp/mscweb/data/himawari/img/fd_/fd__b13_0850.jpg"}
